day,blocktime,blocktitle,type,extra,time,name,title,abstract,bio,video,slides
tue,09:00-09:40,Welcome,org,,09:00,,Welcome,,,,
tue,09:00-09:40,Welcome,org,,09:15,"Calista Redmond, RISC-V International",RISC-V in 2024,,,,
tue,9:40-10:30,Keynotes,keynote,,09:40,"Roger Espasa, Semidynamics Technology Services SL",All-in-One RISC-V AI compute engine,"In this talk we will describe Semidynamic's solution for future-proof AI compute, based on the combination in a single element of Semidynamics RISC-V core, vector and tensor unit. We will cover the new tensor instructions implemented by Semidynamics, how these can be used in AI convolutions and matrix multiplication. We will also cover the need for the vector unit in modern AI models, such as LLMs, to properly run activations. ","Roger Espasa is the CEO and founder of Semidynamics, an IP supplier of two RISC-V cores, Avispado (in-order) and Atrevido (out-of-order) supporting the RISC-V vector extension and Gazzillion(tm) misses, both targeted at HPC and Artificial Intelligence. Prior to the foundation of the company, Roger was Technical Director/Distinguished Engineer at Broadcom leading a team designing a custom ARMv8/v7 processor on 28nm for the set-top box market. Before its experience at Broadcom, from 2002 to 2014, Roger led various x86 projects at Intel as Principal Engineer: SIMD/vector unit and texture sampler on Knights Ferry (45nm), L2 cache, texture sampler on Knights Corner (22nm), the out-of-order core on Knights Landing (14nm) and the Knights Hill core (10nm). From 1999 to 2001 he worked for the Alpha Microprocessor Group on a vector extension to the Alpha architecture. Roger got his Phd in Computer Science from Universitat Politècnica de Catalunya in 1997 and has published over 40 peer reviewed papers on Vector Architectures, Graphics/3D Architecture, Binary translation and optimization, Branch Prediction, and Media ISA Extensions. Roger holds 9 patents with 41 international filings.",,
tue,9:40-10:30,Keynotes,keynote,,10:00,"Thomas Heurung, Siemens EDA",Take advantage of RISC-V without adding risk to your next generation SoC and system design,"The power and flexibility of RISC-V is having a profound impact on how SoC designers and silicon architects are implementing their current and future designs. This newfound freedom however, opens up challenges in the areas of exploration, verification, validation and deployment of the design, as well as the team expertise needed to deliver a working product on schedule.

In this presentation, we will explore how Siemens, with collaboration with our RISC-V ecosystem partners, and customers, has been able to eliminate these new sources of risk and improve schedule predictability for RISC-V based designs. From the earliest stages of design, through functional validation and production deployment, Siemens’ solutions support RISC-V. Our long history of working with our customers on both standard and custom processor designs and SoCs translates directly to RISC-V work. 

Siemens EDA is dedicated to helping companies engineer a smarter future faster with its industry-leading portfolio of EDA software, hardware and services. Technology support specifically targeted to RISC-V includes these Siemens EDA platforms: Veloce, Questa, Catapult, and Tessent.","Since graduating with a degree in electrical engineering in 1997 from Friedrich-Alexander University in Erlangen, Thomas Heurung has been assisting customers in solving various challenges in industrial applications. His first engagements were with the development of electrical systems for automobiles and airplanes, embedded software for distributed control systems, and eventually moved on to the development of complex electronic systems and components.
After transitioning from Synopsys to Mentor Graphics in 2004, which became part of Siemens AG in 2017 and is now known as Siemens Electronic Design Automation, he held various responsibilities such as global business development and establishing and leading technical sales in Europe and India for the Capital and Volcano product lines.
Since 2020, he is serving as Technical Director, responsible for the technical sales of semiconductor and electronic systems development tools at Siemens EDA in EMEA.",,
tue,9:40-10:30,Keynotes,keynote,,10:15,"tba, Codasip",tba,,,,
tue,10:30-11:30,"Break, Booth, Posters",break,,10:30,,"Break, Booth, Posters",,,,
tue,11:30-12:00,Keynotes,keynote,,11:30,"Krste Asanović, SiFive",RISC-V State of the Union,,,,
tue,12:00-12:15,Talks,technical,,12:00,"Ashley Stevens , Arteris",Optimizing Data Transport Architectures in RISC-V SoCs for AI/ML Applications,,,,
tue,12:15-12:30,Talks,technical,,12:15,"Jim Chun-Nan Ke, Andes Tech",Enhancing convolutional neural network computation with integrated matrix extension,,,,
tue,12:30-14:00,"Lunch, Booth, Posters & Demos",break,,12:40,"Pedro Marcuello, Semidynamics Technology Services SL  ",Demo Theatre Talk: Boosting AI on Semidynamics RISC-V Cores with Custom Tensor Instructions,"In this talk, we will present Semidynamics custom tensor instructions and we will show how to use them to accelerate machine learning workloads. Furthermore, we will also show the speedups achieved on real deep learning models when using the new tensor instructions.","Pedro Marcuello joined Semidynamics in 2018 and currently he is the IP Director of the company. Pedro participated in the architectural design and the RTL development of both Atrevido and Avispado RISC-V family cores, the Vector Unit and the Tensor Unit. Before joining Semidynamics, Pedro worked in Broadcom as IC Design Engineer implementing an ARM v7/v8 multicore for the set-top-box market segment, and previously, Pedro worked at Intel labs for 12 years in multiple research projects. Pedro holds both MSc and PhD in Computer Science from the Universitat Politècnica de Catalunya.",,
tue,12:30-14:00,"Lunch, Booth, Posters & Demos",break,,12:50,"Sven Beyer, Siemens EDA",Demo Theatre Talk: Breaking the RISC-V Processor Customization Barrier with Formal Verification,"RISC-V is gaining immense traction in the embedded space, with more and more application cores emerging as well. This broad range of available cores -- coupled with the ability to include custom extensions -- opens unprecedented innovation opportunities in the SoC domain. However, verification of those highly parameterized core instances, including their custom extensions, remains a time-consuming challenge. (Keep in mind that state-of-the-art processor DV was mostly practiced by only a few big players in the market prior to RISC-V!) In this presentation we will show an automated, customer-proven flow from ISA level specifications of custom extensions through their exhaustive formal verification; and demonstrate results on popular open-source cores.",,,
tue,12:30-14:00,"Lunch, Booth, Posters & Demos",break,,13:00,"Pete Lewin, SiFive",Demo Theatre Talk: Enhancements to SiFive's Essential product line,"Pete Lewin from SiFive will discuss enhancements to its popular Essential product line, bringing new performance and flexibility to embedded applications, automotive and the IoT. ",,,
tue,12:30-14:00,"Lunch, Booth, Posters & Demos",break,,13:10,,"Demo Theatre Talk, tba",,,,
tue,12:30-14:00,"Lunch, Booth, Posters & Demos",break,,13:20,,"Demo Theatre Talk, tba",,,,
tue,12:30-14:00,"Lunch, Booth, Posters & Demos",break,,13:30,"Rich Collins, Synopsys",Demo Theatre Talk: Driving SoC Innovation with Synopsys RISC-V Solutions,"RISC-V is reshaping the tech industry as more companies choose to leverage the customizability, scalability and flexibility offered by the RISC-V ISA and ecosystem. RISC-V provides opportunities for innovation, giving SoC architects and software developers the ability to define new products and create a high degree of differentiation in their product portfolios. However, successful development of RISC-V based SoCs requires expertise in digital design, verification, and embedded systems, along with proven EDA, verification and software development tools. Learn how Synopsys’ comprehensive, ready-to-use design, verification, and ARC-V™  processor IP solutions enable designers to achieve their IC design goals and accelerate time to market for their RISC-V based SoC.","Rich Collins is the product management director for the ARC-V™ RISC-V based processor portfolio at Synopsys and has over 30 years of experience in embedded semiconductor R&D, product marketing and business development. Rich holds an MBA from Duke University's Fuqua School of Business and a BSE in Electrical Engineering from Duke University.",,
tue,14:00-14:30,Invited,keynote,,14:00,"Edward Wilford, Omdia",The intelligent wave: How a growth in advanced and accelerated compute will drive adoption of RISC-V,"Research firm Omdia’s recent report, RISC-V Processors Market Tracker, examines the projected growth of the ISA in six key verticals; automotive, communications, consumer, enterprise, industrial, and mobile. In each of these, the growth of RISC-V is forecast to be driven by increases in the volume and value of what Omdia terms ‘applied intelligence’, encompassing processors for AI, connectivity, and rich embedded applications. This talk will present Omdia’s findings and forecasts for RISC-V in these markets, as well as the firm’s forecast for processors by application.",,,
tue,14:30-15:00,Talks,technical,,14:30,"Simone Manoni, University of Bologna",Towards Neuromorphic Acceleration through Register-Streaming Extensions on RISC-V Cores,,,,
tue,14:30-15:00,Talks,technical,,14:45,"Chiyo Wang, PerfXLab Technologies",PerfXLM: A LLM Inference Engine on RISC-V CPUs,,,,
tue,15:00-16:00,"Break, Booth, Posters & Demos",break,,15:10,"James Shi (Qinghao Shi), Alibaba Damo (Hangzhou) Technology Co., Ltd.",Demo Theatre Talk: Introduction of XuanTie RISC-V,"In this presentation, we will introduce the latest progress in the XuanTie ecosystem, including our IP products, software stack construction, and industry collaborations. We invite you to discuss with us the latest developments in RISC-V.","I am James Shi. I am currently a principal STE at Alibaba Damo academy, my current main focusing is on kernel & Linux OS testing for Xuantie RISC-V processors.
Some of my work is also related wtih validating CPU memory models, system integration testing and performance testing for Xuantie C908 / C920 / C907
With RSIC-V community, I am leading activities for Arch Compatibility Test SIG since 2023 and Certification Steering Committee since 2024, I been dedicated on formalizing the contribution process for ACT tests, and promoting ACT to wider audience. ",,
tue,15:00-16:00,"Break, Booth, Posters & Demos",break,,15:20,"Hualin Wu, Terapines Technology (Wuhan) Co., Ltd.",Demo Theatre Talk: Accelerate RISC-V DSA design with Virtual Board Builder,"Designing a Domain Specific Architecture (DSA) is challenge because it requires evaluating the performance of the software before DSA hardware is ready. It also requires repeatedly tuning the micro-architecture and adding custom instructions to meet specific needs. This demo show presents a novel approach to build a virtual RISC-V IP core and SoC with GUI tools, add custom instructions to accelerate AI applications, and profile performance gain with our integrated cycle accurate simulator. The complete workflow can be done in just a few minutes with our sophisticated RISC-V based ESL toolchain.","Co-Founded Terapines Technology in 2020. Previously worked at Andes Technology, S3 Graphics and Imagination Technologies as a compiler engineer for more than 10 years.",,
tue,15:00-16:00,"Break, Booth, Posters & Demos",break,,15:30,"tba, Codasip","Demo Theatre Talk, tba",,,,
tue,15:00-16:00,"Break, Booth, Posters & Demos",break,,15:40,"Bo Wang, Beijing ESWIN Computing Technology Co., Ltd.","Demo Theatre Talk: ESWIN EIC7700X, Pioneer of RISC-V+AI Computing Solution","EIC7700X is an edge computing SoC with superior performance. With 4-core 64-bit RISC-V processor and independently developed neural network computing unit, it supports full stack floating point computing, and generative large language model. The product has rich interfaces, strong audio/video processing capabilities, highly adaptable in computer vision (CV) applications. At this summit, we brought AI PC and LM application demos of this product.","Vice Chairman of Beijing ESWIN Computing Technology Co., Ltd., with 30 years’ experiences in the Semiconductor industry, 25 years in Intel, rich experiences in R&D, PM, Marketing & Sales, etc.",,
tue,16:00-16:15,Talk,technical,,16:00,"Giulio Urlini, STMicroelectronics",Use of RISC-V to develop multiprocessor host subsystems for accelerated platform with In Memory computing based on NVM memories for AI inference answering functional safety requirements for industrial and automotive applications,,,,
tue,16:15-17:00,Lightning Talks,technical,,16:15,"Larry Lapides, Synopsys",2' Lightning Talk: Synopsys Solutions Drive RISC-V Success,"Developing a RISC-V based SoC, both hardware and software, requires a range of expertise and use of best-known methods and technologies.  Synopsys provides solutions from the beginning of the project, architecting the SoC, through implementation including RISC-V processor IP and verification of self-built RISC-V processors, through to software development on the SoC.","Larry is currently Executive Director of Product Management, responsible for the Imperas branded products in Synopsys.  He was VP Worldwide Sales & Marketing, and a member of the founding team, for Imperas Software Ltd., up until the 2023 acquisition of Imperas by Synopsys.  Prior to Imperas, Larry held VP Sales roles at a couple of EDA startups, and was vice president of worldwide sales during the run-up to Verisity’s IPO (the top performing IPO of 2001 in the U.S.), and afterwards as Verisity solidified its position as the fifth largest EDA company.  Before Verisity and SureFire Verification (acquired by Verisity), Larry held positions in sales and marketing for Exemplar Logic and Mentor Graphics.  Prior to moving into marketing and sales, Larry spent 9 years working on infrared photodiode design and fabrication.  Larry has been on the Clark University School of Management (SOM) Advisory Council since 2003, and was an Entrepreneur-in-Residence at Clark during Fall 2006, when he developed and taught the course on Entrepreneurial Communication and Influence. Larry holds a BA in Physics, with General Distinction in Physics, from the University of California Berkeley, a MS in Applied and Engineering Physics from Cornell University and a MBA from Clark University.  ",,
tue,16:15-17:00,Lightning Talks,technical,,16:20,"tba, Andes Technology",2' Lightning Talks,,,,
tue,16:15-17:00,Lightning Talks,technical,,16:25,"Alessandra Dolmeta, CEA",2' Lightning Talk: Exploring Accelerator Integration With Core-V eXtention InterFace (CV-X-IF) for Kyber,,"Alessandra Dolmeta graduated in Electronic Engineering in 2020 and in Microelectronics in 2022, both at the Politecnico di Torino. She is now a PhD student in Electrical, Electronic and Communications Engineering at the Polytechnic University of Turin, in collaboration with Telsy. The main focus of her research activity is the design of hardware architectures for post-quantum cryptography integrated on RISC-V, with the aim of speeding up and optimising PQC algorithms. Currently, she is working as a visiting PhD student at the CEA/Leti laboratory for Security of Hardware Components in Grenoble.",,
tue,16:15-17:00,Lightning Talks,technical,,16:30,"Bo Wang, Beijing ESWIN Computing Technology Co., Ltd.",2' Lightning Talk: ESWIN Computing’s RISC-V+AI Innovation,Introduction of ESWIN Computing Company and our RISC-V+AI technologies and innovations. Launch of RISC-V+AI Computing Solution - EIC7700X.,"Vice Chairman of Beijing ESWIN Computing Technology Co., Ltd., with 30 years’ experiences in the Semiconductor industry, 25 years in Intel, rich experiences in R&D, PM, Marketing & Sales, etc.",,
tue,16:15-17:00,Lightning Talks,technical,,16:35,"Jan Andersson Nerén, Frontgrade Gaisler",2' Lightning Talk: A Space-Grade Fault-Tolerant Radiation-Hardened MPSoC,"The GR765 is the fifth-generation European space-grade microprocessor in development by Frontgrade Gaisler. It is a RISC-V based multi-processor system-on-chip with NOEL-V RV64 RISC-V processor cores. It supports DDR2/3/4 SDRAM and NAND Flash memory with advanced error detection and correction capabilities. The communication interfaces include a SpaceWire router, SpaceFibre, Ethernet, MIL-STD-1553, and CAN-FD interfaces.","Mr Jan Andersson Nerén. M.Sc in Computer Engineering focused on digital design and embedded systems. Director of Engineering at Frontgrade Gaisler, where he oversees hardware and software development efforts and leads implementation of the system-on-chip architecture roadmap. Jan's accomplishments include development and verification of the GR740 quad-core LEON4FT, UT700 LEON3FT, and GR712RC dual-core LEON3FT space-grade microprocessors and maintenance of the open-source hardware GRLIB IP Library that includes the NOEL-V RISC-V processor model.",,
tue,16:15-17:00,Lightning Talks,technical,,16:40,"Markus Herdin, Lauterbach GmbH",2' Lightning Talk: Enabling Innovation with RISC-V – The Perspective of the Leading Debug Tool Supplier,"Markus Herdin will talk about Lauterbach's commitment to enabling innovation in embedded systems by providing debugging tools the industry needs, for the entire silicon lifecycle. With RISC-V on the rise, Lauterbach is here to enable innovation with RISC-V.","Markus Herdin, Head of Marketing at Lauterbach GmbH, is a seasoned market and business development professional with a background in the test and measurement and wireless industries. His experience includes market and business development, product management, product development, corporate strategy and research. He also serves as an advisor to start-up companies. Markus holds a Ph.D. in Electrical Engineering and an MBA from the University of Chicago Booth.",,
tue,16:15-17:00,Lightning Talks,technical,,16:45,"Dany Nativel, SiFive",2' Lightning Talk: Exciting possibilities with the SiFive HIFive Premier P550 development board ,"Dany Nativel from SiFive will discuss the exciting possibilities with the SiFive HIFive Premier P550 development board that will be widely available shortly after the show, The new board is the most powerful RISC-V development board yet, enable development on a wide range of projects and designs. ",,,
tue,16:15-17:00,Lightning Talks,technical,,16:50,"tba, Tristan",2' Lightning Talks,,,,
tue,16:15-17:00,Lightning Talks,technical,,16:55,"Ze Fan, TeraPines",2' Lightning Talk: One Platform for RISC-V Software and Hardware Optimizations,"Open source toolchain currently plays an important role in RISC-V software infrastructure. However, in areas where RISC-V could bring the most difference, which is DSA, open source tools like gcc and llvm often fall short. We present a one-stop solution for both general-purpose and domain-specific language compiler optimization, debugging and performance evaluation. This helps our customers achieve superior performance, faster custom ISA extension iterations and architecture evaluation.","Joined Terapines Technology as CEO in 2023. Previously worked as ASIC engineer at HiSilicon and NVIDIA, followed by portfolio manager and executive director in private equities in the semiconductor industry.",,
tue,17:00-17:15,Panel Introduction Keynote,keynote,,17:00,Philipp Tomsich,RISC-V: Charting the Future of AI/ML with Open Standards and Global Collaboration,,,,
tue,17:15-18:00,Panel,keynote,,17:15,,Accelerating AI Innovation with RISC-V,,,,
tue,18:00-20:00,"On-Site Cocktail, Booth, Posters",social,,18:00,,sponsored by Codasip,,,,
wed,09:00-10:15,Keynotes,keynote,,09:00,"Thomas Böhm, Infineon",RISC-V - Success factors & opportunities for dependable automotive applications,,,,
wed,09:30-10:15,Keynotes,keynote,,09:30,"Balaji Baktha, Ventana Micro Systems",tba,,,,
wed,09:30-10:15,Keynotes,keynote,,09:45,"Bao Yungang, Beijing Institute of Open Source Chip",Open-Source at BOSC: Achievements and Challenges,"The Beijing institute of Open-Source Chip (BOSC), founded in 2021, develops strong ties with academia and industry. In addition to the successful development of industry's open source and high-performance RISC-V CPU core XiangShan, a core mission of BOSC is to promote and contribute to the open-source chip ecosystem, covering not only design tools (such as agile development tools and open-source EDA tools), but also verification methodologies (such as open-source verification) and education (such as the One Student One Chip (OSOC) Initiative). This presentation will introduce 3-5 key contributions that BOSC has made or plans to make to the open-source chip ecosystem in terms of exploration, achievements and lessons learned.","Yungang Bao is a professor of Institute of Computing Technology (ICT), Chinese Academy of Sciences (CAS) and the deputy director of ICT, CAS. Prof. Bao founded China RSIC-V Alliance (CRVA) and serves as the secretary-general of CRVA. His research interests include computer architecture and computer systems. He is leading the XiangShan project (https://github.com/OpenXiangShan/XiangShan
), which aims to build an open-source high performance RISC-V core. He launched the One Student One Chip (OSOC) Initiative in 2019. His work was published on top conferences and journals such as ASPLOS, Communication of the ACM, HPCA, ISCA, MICRO etc. and was selected to IEEE Micro Top  Picks. He was the winner of CCF-Intel Young Faculty Award of the year for 2013 and the winner of CCF-IEEE CS Young Computer Scientist Award and China’s National Lofty Honor for Youth under 40 of the year for 2019.",,
wed,09:30-10:15,Keynotes,keynote,,10:00,"Gavin Ferris, lowRISC","The Silicon Commons — Build Together, Build Well and Build Securely","Throughout industry, there is a noticeable increase in the adoption of open source designs — including RISC-V cores such as IbexⓇ — in commercial SoCs. Companies of all sizes are finding that they can innovate more quickly by leveraging, and contributing to, this vibrant ecosystem. In this presentation we'll describe the benefits collaboration can bring to the security of all devices — from the simplest microcontrollers through to complex multi-chiplet architectures. In particular we'll explain how lowRISC's Silicon CommonsⓇ approach has enabled OpenTitanⓇ, developed by a consortium of industry leaders and academics, to
reach commercial availability and is now enabling the Sunburst project to drive security by design through adoption of RISC-V with CHERI extensions.",,,
wed,10:15-10:30,Talk,technical,,10:15,"Manuel Arenaz, Codee",The First Study of the Impact of Codee on SiFive's LLVM RISC-V Development Ecosystem,"The widespread industry adoption of the open RISC-V instruction set architecture requires a robust, mature RISC-V software development ecosystem. The upstream LLVM developer tools for RISC-V are evolving rapidly, but still need further improvements to compete with the well-established ARM and x86 architectures. Codee is a new automatic code inspection tool to help developers optimize C/C++/Fortran codes. This is the first work evaluating the impact of Codee on the LLVM RISC-V ecosystem. The results show up to 7.5x performance boost of well-known open-source codes targeting SiFive's P470 processor using single-core optimizations for vectorization and memory efficiency. The authors are not aware of a similar approach in LLVM and RISC-V and believe Codee is a new and revolutionizing solution that makes the ecosystem even better.",,,
