day,blocktime,blocktitle,type,extra,time,name,title,abstract,bio,video,slides
wed,9:00-10:30 ,Keynotes,keynote,,9:00,"Luca Benini, ETH Zürich, Università di Bologna","Open RISC-V Platforms for Energy-Efficient, Scalable Computing","Today’s data-parallel workloads in HPC, AI, IoT demand ever-growing performance under an (almost) constant power envelope. To address this fundamental challenge in a regime of diminishing returns from technology scaling, we must minimize overhead associated with data transfer, data-flow management, as well as instruction fetching, decoding, while introducing “controlled doses” of domain specialization. The last decade has seen the rise of open instruction sets, open architectures, and open hardware as key enablers for designing more efficient computing systems. In this talk, I share insights gained in a decade of design adventures on open-source RISC-V hardware and software for energy-efficient computing, moving from tiny, parallel ultra-low power chips to high-performance many-core chiplets, and provide a personal view on future directions.  ","Luca Benini holds the chair of digital Circuits and systems at ETHZ and is Full Professor at the Universita’ di Bologna. He received a PhD from Stanford University. Dr. Benini’s research interests are in energy-efficient parallel computing systems, smart sensing micro-systems and machine learning hardware. He is a Fellow of the IEEE, of the ACM and a member of the Academia Europaea. He is the recipient of the 2016 IEEE CAS Mac Van Valkenburg award, the 2020 EDAA achievement Award, the 2020 ACM/IEEE A. Richard Newton Award and the 2023 IEEE CS Edward J. McCluskey award.  ",,2023-06-07-09h00-Luca-BENINI-slides.pdf
wed,9:00-10:30 ,Keynotes,keynote,,9:30,"Dr Yungang Bao, China RISC-V Alliance (CRVA), Beijing Institute of Open-Source Chip (BOSC)",RISC-V in China: Embracing the Era of Open-Source Chip,"RISC-V has made a significant impact on the chip industry and academia all over the world. China’s RISC-V community shares the same goals of building a shared global RISC-V ecosystem and has been one of the main contributors to the RISC-V ecosystem. In this talk, I will first summarize the status of RISC-V in China and then introduce two specific projects towards building an open-source chip ecosystem: (1) The XiangShan project targets an open-source high-performance RISC-V core (https://github.com/OpenXiangShan/XiangShan); (2) The One Student One Chip (OSOC) Initiative aims to train undergraduates by building real RISC-V chips and has already attracted about 3000 participants from 300+ universities.  ","Yungang Bao is a professor of Institute of Computing Technology (ICT), Chinese Academy of Sciences (CAS) and is the deputy director of ICT, CAS. He also serves as Chief Scientist of Beijing Institute of Open Source Chip (BOSC) and BoD/TSC member of RISC-V International. He founded the China RSIC-V Alliance (CRVA) and serves as the secretary-general of CRVA. His prior research works have been adopted by Alibaba, Huawei, Intel and Microsoft etc. Over the past years, he has been leading the XiangShan project and the One Student One Chip (OSOC) Initiative. He was the winner of CCF-Intel Young Faculty Award of the year for 2013 and the winner of CCF-IEEE CS Young Computer Scientist Award and China’s National Lofty Honor for Youth under 40 of the year for 2019.  ",,2023-06-07-09h30-Yungang-BAO-slides.pdf
wed,9:00-10:30 ,Keynotes,keynote,,10:00,"Dominic Rizzo, zeroRISC Inc, OpenTitan","OpenTitan: Past, Present and Future of Open Source Secure Silicon","OpenTitan brought a new level of transparency to secure silicon development with its first discrete chip design, freely available today. However, OpenTitan has always had broader goals than a single discrete silicon root of trust.

This talk will discuss the entire OpenTitan family of permissively licensed design and verification IP in the broader context of creating a high quality open silicon ecosystem. I will review the current state of the project, both the upcoming commercial discrete device tapeout and forthcoming designs built from the OpenTitan IP ecosystem.

I will explore our unique Silicon Commons approach to development across diverse partners and geographies, including how our governance model – hosted by the non-profit engineering firm, lowRISC C.I.C. – created a stable community development platform. Finally, I will present how our commitment to open development led to commercial and research innovations today, concretely demonstrating the value of implementation and development transparency.","Mr. Dominic Rizzo is CEO and co-founder of zeroRISC Inc., a RISC-V start-up working in the open source silicon space. He founded the OpenTitan project, the world’s first open source silicon root of trust design, and currently serves as its Project Director. He previously developed the first FIPS 140-2 certified Enterprise U2F Security Key, and has research interests in hardening silicon against physical attacks and side channels, trustworthy authenticators, and formal methods for proof of implementation correctness. He received his BS in Aerospace Engineering from the Massachusetts Institute of Technology and his MS in Computer Science from the California Institute of Technology.  ",,2023-06-07-10h00-Dominic-RIZZO-slides.pdf
wed,10:30-11:30 ,"Break, Booth, Posters & Demos ",break,Demo Theatre,10:40,Semidynamics Team,Semidynamics Vector Unit Performance Demonstration,In this demo session we will show the Semidynamics vector unit running several visual benchmarks and compare their performance against a core without vector unit.  ,,,
wed,10:30-11:30 ,"Break, Booth, Posters & Demos ",break,Demo Theatre,10:55,"Zdenek Prikryl, Codasip",RISC-V as an enabler of heterogeneous compute,"The semiconductor industry has benefited from shrinking process nodes to improve performance while reducing cost and power for many years. But this no longer holds. We can’t rely on smaller silicon geometries to achieve computational improvements. Instead, we are in a world where performance, power, and cost benefits must come from the architecture and from custom compute. With many possible specialized processor architectures, processor design automation is essential to ensure that design cycles are short and cost effective. In this demo, we will go through some examples that show how RISC-V designs are customized for computational workloads in different domains using a single, unified toolchain for processor design automation.  ",,,
wed,10:30-11:30 ,"Break, Booth, Posters & Demos ",break,Demo Theatre,11:10,"Warren Chen, Andes Technology",Andes AI Runs Everywhere with DSP/Vector/NN Libraries and AndesClarity,"AI applications require efficient and powerful flexible computing capabilities of the Processor. AndesCore™ DSP/SIMD Extension (RVP) and Vector Extensions (RVV) could efficiently boost the performance with respective intrinsic functions, and highly optimized DSP, Vector, and NN libraries. In this talk, we will explore the AndesCore™ AX45MPV Vector Processor and AI software stack and solutions. With the help of the AndesClarity™ pipeline visualizer and analyzer, developers could identify stall bubbles and data and resource dependencies associated with instructions and source code for further optimizations.  ","Warren Chen is a Senior Technical Manager at Andes Technology, where he works in the Technical Marketing Division. Warren has over 20 years of work experience ranging from embedded operating system porting, device driver, middleware, software architecture, project management, and marketing. He is excited to be part of the dynamic and growing RISC-V community.  ",,
wed,11:30-12:00 ,Keynote,keynote,,11:30,"Lars Bergstrom, Google",Android on RISC-V: Progress and Updates,"In this talk, we will discuss the progress that has been made in supporting RISC-V in Android and the [Android Open Source Platform (AOSP)](https://source.android.com/).

We will cover the following topics:
- The progress that has been made in supporting RISC-V and recently-ratified extensions and the RVA22 profile in Android and AOSP
- Updates on language support from C/C++, Rust, Java, and other languages for new RISC-V specifications targeting Android
- An overview of how we have been investing alongside the broader RISC-V ecosystem to bring production-readiness to some key open source projects","Lars Bergstrom is a Director of Engineering at Google on the Android team, working on their platform programming languages, including Java, C/C++, and Rust and the supporting tools and libraries. He also serves as Google’s Corporate Director to RISC-V International and Chair of the Board of Directors of the Rust Foundation. Before Google, he was at Mozilla Research, initially contributing to the Servo browser project and directing the integration of Rust into Firefox and the partner ecosystem. Later, he led Mozilla’s AR and VR work, shipping software and building OEM relationships on many different devices. He received his Ph.D. in Computer Science from the University of Chicago in 2013.  ",,
wed,12:00-12:30,Technical Talks,technical,,12:00,"Dave Ditzel, founder and CTO of Esperanto Technologies",RISC-V's revolutionary role for simultaneously supporting machine learning and HPC,,,,
wed,12:00-12:30,Technical Talks,technical,,12:15,"Umair Riaz, BSC",MEDEA: Improved Memory-Level Parallelism in a decoupled execute/access vector accelerator,,,,
wed,12:30-14:00,"Lunch, Booth, Posters & Demos ",break,Demo Theatre,13:00,"Brian Colgan, Microchip",Introducing the PolarFire® SoC Smart Embedded Vision Kit,,,,
wed,12:30-14:00,"Lunch, Booth, Posters & Demos ",break,Demo Theatre,13:15,"Jan Andersson, Frontgrade Gaisler",Designing a RISC-V SoC with the NOEL-V Processor and the GRLIB IP Library,,,,
wed,12:30-14:00,"Lunch, Booth, Posters & Demos ",break,Demo Theatre,13:30,"Dr. Ari Kulmala, TII",Secure RISC-V for Flight controller and Mission Computer,,,,
wed,14:00-14:30,Keynote,keynote,,14:00,"Patrick Pype, NXP",TRISTAN: Together for RISC-V Technology and Applications,,,,
wed,14:30-15:30,Industry Talks,technical,,14:30,"Karol Gugala, Antmicro & Matt Cockrell, Google",Enabling Collaborative Chip Design in the RISC-V VeeR core and Caliptra RoT Project with CHIPS Alliance tools,,,,
wed,14:30-15:30,Industry Talks,technical,,14:45,"Joaquim Maria Castella Triginer, Virtual Vehicle Research GmbH",Enhancing Safety with RISC-V-based SPIDER Autonomous Robot:A Use-Case from the ECSEL FRACTAL Project,,,,
wed,14:30-15:30,Industry Talks,technical,,15:00,"Duncan Graham, Imperas Software",Hybrid Simulation with Emulation for RISC-V Software Bring Up and Hardware-Software Co-Verification,,,,
wed,14:30-15:30,Industry Talks,technical,,15:15,"Hualin Wu, Terapines Ltd",Accelerate HPC and AI applications with RVV auto vectorization,,,,
wed,15:30-16:30,"Break, Booths & Posters ",break,,,,Exhibition / Poster Sessions ,,,,
wed,16:30-16:45 ,Industry Talk,technical,,16:30,"Jeremy Bennett, Embecosm",The CORE‑V software ecosystem: Ten lessons learned from developing vendor specific compiler tool chains,,,,
wed,16:45-17:15,Keynote,keynote,,16:45,"Matthew Xuereb, European Commission",The European Chips Act: Enabling chip design in Europe,,,,
wed,17:15-18:00 ,Panel,keynote,,17:15,"Calista Redmond, RISC-V (moderator). Luis-Carlos Busquets-Perez, EU Commission. John D. Davis, BSC. Roger Espasa, Semidynamics. Daniel Opalka, EuroHPC. Patrick Pype, NXP. Stefan Wallentowitz, Munich University of Applied Sciences",Pannel on EU & RISC-V,,,,
wed,20:00-23:00,Off-Site Social Event,social,,,,Connect with your fellow Summit attendees for an evening of food and drinks at the beautiful [Estació de França](http://restauranteestaciondefrancia.com/),,,,
thu,09:00-10:00,Keynotes,keynote,,9:00,"Philipp Tomsich, VRULL GmbH",SW-driven evolution of a uniquely modular and extensible ISA,,,,
thu,09:00-10:00,Keynotes,keynote,,9:30,"Thierry Collette, Thales R&T",4 years of Open Source RISC-V at Thales,,,,
thu,10:00-10:15,Industry Talk,technical,,10:00,"Wei-han Lien, Tenstorrent",A high-fidelity flow for high-performance RISC-V CPU design from scratch,,,,
thu,10:15-10:30,Technical Talk,technical,,10:15,David Mallasén Quintana (Universidad Complutense De Madrid),PERCIVAL: Integrating Posit and Quire Arithmetic into the RISC-V Ecosystem,,,,
thu,10:30-11:30,"Break, Booths & Posters",break,,,,Exhibition / Poster Sessions ,,,,
thu,11:30-12:00 ,Keynote,keynote,,11:30,"Alex Bradbury, Igalia",Developments in LLVM-based toolchains and tooling for RISC-V,,,,
thu,12:00-12:30,Technical Talks,technical,,12:00,"Stanislaw Kaushanski, MINRES GmbH",Automated Cross-level Verification Flow of a Highly Configurable RISC-V Core Family with Custom Instructions,,,,
thu,12:00-12:30,Technical Talks,technical,,12:15,"Andrei Warkentin, Intel",Multi-ISA Firmware Compatibility - Bringing RISC-V and IHV Ecosystems Together,,,,
thu,12:30-14:00,"Lunch, Booths & Posters ",break,,,,Exhibition / Poster Sessions ,,,,
thu,14:00-14:30,Keynote,keynote,,14:00,"Roland Weigand, European Space Agency (ESA)",RISC-V: a Rising Star in Space,,,,
thu,14:30-15:30,Technical Talks,technical,,14:30,"Luca Lingardo, NXP",Implementation of an Edge-Computing architecture based on a RISC-V core for RFID communication,,,,
thu,14:30-15:30,Technical Talks,technical,,14:45,"Guy Lemieux, University Of British Columbia",From CCX to CIX: A Modest Proposal for (Custom) Composable Instruction eXtensions,,,,
thu,14:30-15:30,Technical Talks,technical,,15:00,"Tariq Kurd, Codasip",RISC-V code-size reduction with Zc extensions and dictionary compression custom instruction,,,,
thu,14:30-15:30,Technical Talks,technical,,15:15,"Andrei Ivanov, ETH Zürich",RIVETS: An Efficient Training and Inference Library for RISC-V with Snitch Extensions,,,,
thu,15:30-16:30,"Break, Booths & Posters",break,,,,Exhibition / Poster Sessions ,,,,
thu,16:30-17:45,Technical Talks,technical,,16:30,"Gregory Chadwick, lowRISC",Building commercially relevant open source silicon: The many aspects of Ibex,,,,
thu,16:30-17:45,Technical Talks,technical,,16:45,"Marton Bognar, imec-DistriNet, KU Leuven",Proteus: An Extensible RISC-V Core for Hardware Extensions,,,,
thu,16:30-17:45,Technical Talks,technical,,17:00,"Thomas Benz, ETH Zürich",Puma: An End-to-End Open-Source Linux-capable RISC-V SoC in 130nm CMOS,,,,
thu,16:30-17:45,Technical Talks,technical,,17:15,"Bruno Sá, University Of Minho",RISC-V Virtualization: A Case Study on the CVA6,,,,
thu,16:30-17:45,Technical Talks,technical,,17:30,"Yifei Zhu, Rios Lab, Tsinghua-berkeley Shenzhen Institute, Tsinghua University",GreenRio: A Linux-Compatible RISC-V Processor Designed for Open-Source EDA Implementations,,,,
thu,17:45-18:00,Closing,keynote,,,"Calista Redmond, RISC-V International & Christian Fabre, CEA & more…",Closing & Announcements,,,,
thu,,,,,,,,,,,
thu,,,,,,,,,,,
thu,,,,,,,,,,,
thu,,,,,,,,,,,
thu,,,,,,,,,,,
thu,,,,,,,,,,,
thu,,,,,,,,,,,
thu,,,,,,,,,,,
thu,,,,,,,,,,,
thu,,,,,,,,,,,
thu,,,,,,,,,,,
