day,blocktime,blocktitle,type,extra,time,name,title,abstract,bio,video,slides
tue,9:00-9:45,Opening and Introduction,org,,9:00,"Calista Redmond, RISC-V International",Opening,,,T0M9qV_v3Fc,2023-06-06-09h00-Calista-REDMOND-slides.pdf
tue,9:00-9:45,Opening and Introduction,org,,9:20,"Christian Fabre, CEA",Welcome from the RISC-V Summit Europe Steering Committee,,,,2023-06-06-09h20-Christian-FABRE-slides.pdf
tue,9:00-9:45,Opening and Introduction,org,,9:30,"Daniel Müller-Gritschneder, Technical University Munich & Teresa Cervero, BSC",RISC-V Summit Europe Program Overview,,,,2023-06-06-09h30-Daniel-MÜLLER-GRITSCHNEDER-slides.pdf
tue,9:45-10:30 ,Keynotes,keynote,,9:45,"Mark Himelstein, RISC-V International ",RISC-V: The Road Ahead and Technical Update,,"Before RISC-V international Mark Himelstein was the President of Heavenstone, Inc. which concentrated on Strategic, Management, and Technology Consulting providing hardware and software product architecture, analysis, mentoring and interim management. Previously, Mark started Graphite Systems, Inc (acquired by EMC) where he was the VP of Engineering and CTO developing large Analytics Appliances using highly integrated FLASH memory. Prior to Graphite, Mark held positions as the CTO of Quantum Corp, Vice President of Solaris development engineering at Sun Microsystems and other technical management roles at Apple, Infoblox, and MIPS.",,2023-06-06-09h45-Mark-HIMELSTEIN-slides.pdf
tue,9:45-10:30 ,Keynotes,keynote,,10:00,"Rick O’Connor, OpenHW Group",Commercial Adoption of CORE-V Open-Source RISC-V Cores - Lessons Learned,"This talk will provide a brief overview of Open-Source HW activity across the industry, barriers to adoption of Open-Source HW and challenges associated with SoC design.  Lessons learned related to the OpenHW Group Governance model and commercial adoption of CORE-V Family of open source RISC-V cores will also be presented. The CORE-V family is an OpenHW Group project to develop, deploy, and execute pre-silicon functional verification and SoC based development kits of the CORE-V family of open-source RISC-V cores. Written in SystemVerilog, CORE-V open-source IP cores match the quality of IP offered by established commercial providers and are verified with state-of-the-art, auditable flows.","Rick O'Connor is Founder and serves as President & CEO of the OpenHW Group a not-for-profit, global organization driven by its members and individual contributors where hardware and software designers collaborate on open source cores, related IP, tools and software projects. Previously Rick was Executive Director of the RISC-V Foundation. Founded by Rick in 2015 with the support of over 40 Founding Members, the RISC-V Foundation currently comprises more than 400 members building an open, collaborative community of software and hardware innovators powering processor innovation. With many years of Executive level management experience in semiconductor and systems companies, Rick possesses a unique combination of business and technical skills and was responsible for the development of dozens of products accounting for over $750 million in revenue. Rick holds an Executive MBA degree from the University of Ottawa, Canada and is an honors graduate of the faculty of Electronics Engineering Technology at Algonquin College, Canada.",,2023-06-06-10h00-Rick-O'CONNOR-slides.pdf
tue,9:45-10:30 ,Keynotes,keynote,,10:15,"Balaji Baktha, Ventana Micro Systems",Paving the Road Ahead: RISC-V and Chiplet Technologies in Modern Automotive and Data Center Architectures,"This presentation will explore the frontier where cutting-edge computing intersects with the rapidly evolving automotive industry.  As cars become increasingly reliant on advanced technologies for safety, efficiency, and performance, new design paradigms are required.  Balaji will provide an exploration of how Ventana is leveraging the power of RISC-V and chiplet technologies to revolutionize how automotive manufacturers take control of their technology supply chain and enable differentiated platforms.  The session will provide insights into not only the technology itself but also into the broader implications for the automotive industry and manufacturers.","Balaji Baktha is the founder and CEO of Ventana Micro Systems, a leader in high-performance RISC-V processors. He is an experienced semiconductor executive and a serial technology entrepreneur and investor with a proven track record in founding and exiting several successful startups over more than 30 years in Silicon Valley. Balaji is a board member of RISC-V International as well as several other startups, and a Limited Partner and Senior Advisor at PE and VC funds. Prior to Ventana, Balaji was the founder and CEO of Veloce Technologies, the world’s first 64-bit ARM based high performance processor for cloud-compute (acquired by AppliedMicro). Before Veloce, Balaji was the VP and GM of the Communications Business at Marvell Semiconductor where he managed multiple product groups including compute, wired and wireless networking, and Enterprise Storage SoCs. Before Marvell, Balaji co-founded Platys, a startup that pioneered iSCSI storage networking and was subsequently acquired by Adaptec (now Microsemi). Prior to Platys, Balaji founded Shuttle Technologies (acquired by SCM Micro) to build the first digital media & storage I/O SoCs for Apple, Sony, and HP.",,2023-06-06-10h15-Balaji-BAKTHA-slides.pdf
tue,10:30-11:30,"Break, Booth, Posters & Demos ",break,Demo Theatre,10:40,"Kumar Sankaran, Ventana Micro Systems",Data Center Workloads on RISC-V,,,,
tue,10:30-11:30,"Break, Booth, Posters & Demos ",break,Demo Theatre,10:55,"Karol Gugala, Antmicro","Bare metal AI runtime deployment and analysis for a RISC-V accelerator with Kenning, Renode and IREE","Thanks to their increasing computational capabilities and the open ISA’ s ability to tailor silicon to specific use cases, RISC-V based microcontroller devices are an interesting target for Machine Learning workflows in low-power applications. To make the best of the constrained resources of MCUs, Antmicro’s Kenning open source AI/ML framework was extended with a bare-metal runtime backend, enabling use with RISC-V based devices that cannot - or don’t need to - run Linux. Kenning enables you to seamlessly develop, train, optimize and deploy ML models on various embedded targets and can automatically convert the model format between the most popular AI frameworks and optimize models for their target runtime. The metrics from the deployed models can be utilized to monitor various aspects of processing, from machine resource usage to result quality.  To further improve the developer experience, Kenning has been integrated with Renode, Antmicro’s open source, deterministic simulation framework. The integration of Kenning and Renode enables a hardware-less development flow and allows for complete insight into model execution and AI accelerator utilization. Renode provides a fully automated, reproducible execution environment, allowing a CI-based development of embedded models, optimization libraries, and AI accelerators. The demo will present a complete ML model deployment flow based on Kenning, targeting Google’s Springbok RISC-V AI accelerator and leveraging the RISC-V Vector Extension, fully simulated in Renode.","Karol Gugala is Engineering Manager at Antmicro, where he leads the software team and works with open source in various contexts - digital design, AI and low level software. Open source enthusiast - involved in a wide variety of FOSS projects and is Chairman of CHIPS Alliance Tools Workgroup. He has 10+ years of experience in low level software, VHDL, Linux and Verilog.  ",,
tue,10:30-11:30,"Break, Booth, Posters & Demos ",break,Demo Theatre,11:10,"Chris Morrison, Agile Analog",An innovative digitally wrapped analog IP subsystem for RISC-V applications,"Digital chip designers face a significant challenge when it comes to integrating the necessary analog circuitry to support their SoC designs. They can experience difficulties in obtaining appropriate analog IP for specific processes and foundries, and struggle with the integration of multiple analog IP blocks from different vendors into their systems. The integration of analog and digital at the mixed-signal boundary poses a particularly daunting and resource-intensive task, requiring specialized knowledge and tools. To address these challenges, Agile Analog present an innovative analog IP subsystem for RISC-V applications. This subsystem is designed to be customizable, and digitally wrapped, offering a novel solution that tackles many of the issues encountered by SoC designers with existing solutions. Specifically, Agile Analog’s subsystem includes a comprehensive set of analog IP components essential for a typical battery-powered IoT system, including a power management unit (PMU), a sleep management unit (SMU), and data converters. These IP components undergo thorough verification in both analog and digital environments, ensuring their reliability and performance, plus seamlessly connect to the MCU’s peripheral bus and are supplied with a SystemVerilog model, facilitating their integration into an existing SoC’s verification environment.  ",,,
tue,11:30-12:15,Keynotes,keynote,,11:30,Jon Taylor - Imperas Software Ltd,The RISC-V Verification Ecosystem with Open Standards and Commercial Tools,"The freedom of RISC-V represents both new innovations in design and also the migration of verification responsibility. This keynote highlights the challenges facing SoC teams as they adopt RISC-V and provides a perspective on how the use of new verification standards and methodologies drives down cost, quality risk, and development time.  ","Jon Taylor has over 20 years of experience in the semiconductor industry, working in technical areas from CPU verification to embedded software, and commercial areas including field applications and technology strategy. He has worked on multiple architectures including Arm, RISC-V and proprietary CPUs. He holds a degree from Southampton University in Electronic Engineering and is currently Director of Product Technology for Imperas working on technology to help enable the RISC-V revolution.  ",,2023-06-06-11h30-Jon-TAYLOR-slides.pdf
tue,11:30-12:15,Keynotes,keynote,,11:45,"Brett Cline, Codasip","RISC-V customization, HW/SW co-optimization, and custom compute","If you optimize your software for a general-purpose core there is a substantial risk that your algorithms are executed inefficiently and therefore run slowly. You can address this by creating fixed-function circuits designed to perform a specific set of operations. These hardware functions can be extremely fast, but because they are hard coded, it is difficult to modify or update them. So how can you achieve flexibility and performance? By combining both approaches. A key benefit of RISC-V customization is that you can create custom instructions tailored to your specific application needs.

To pick custom instructions correctly and create efficient implementations, software and hardware teams need to collaborate. By starting work earlier on processor customization, the software team can start developing their critical algorithms and uncover much sooner those potential gains that could not be achieved if the hardware was already frozen.  We call this Custom Compute, and its benefits extend beyond performance and energy efficiency. Custom Compute can also enable organizations to improve security by adding security features at the heart of the processor. A closer collaboration between hardware and software teams, supported by a strong methodology and by efficient tools, is the future standard of system design.",,,2023-06-06-11h45-Brett-CLINE-slides.pdf
tue,11:30-12:15,Keynotes,keynote,,12:00,"Charlie Su, Andes Technology",RISC-V is Firing on All Cylinders,"RISC-V has been adopted with a record-breaking speed in pretty much all applications from general-purpose tiny MCUs to datacenter AI/ML accelerator SoCs. In this keynote, we will give examples of RISC-V applications and solutions to support them; in particular, we will also analyze various approaches for matrix multiplication extension to embrace AI/ML acceleration directly in RISC-V architecture. In addition, ISO 26262 certified automotive electronics solutions have been highly sought after in recent years due to multiple catalysts. In the second part of the keynote, we will talk about how RISC-V solutions address such market, some successful examples, and new technical challenges we should look into.  ","Dr. Charlie Su is a Cofounder, President and CTO of Andes, a 18-year pure-play CPU IP vendor. Charlie’s main focus is on product definition, development and promotion. He spent over 12 years in the Silicon Valley with various technical and management positions at Sun Microsystems, Afara Websystems, C-Cube Microsystems, SGI/MIPS, and Intergraph. He made key contributions to several successful processors such as the Sun multi-core multi-threading Ultrasparc T1 and T2 processors, the C-Cube high-performance E-series MPEG media processors, the MIPS out-of-order R10K processor, and the Intergraph Clipper VLIW processor. Prior to starting Andes, he led the CPU and DSP development in Faraday Technology as Chief Architect. Charlie obtained his Ph.D. in CS from the University of Illinois at Urbana-Champaign, M.S. in CS from National Tsing-Hua University, and B.S. in EE from National Taiwan University.  ",,2023-06-06-12h00-Charlie-SUE-slides.pdf
tue,12:15-12:30,Technical Talk,technical,,12:15,"Daniele Rossi, University of Pisa",HW-SW Interface for RAS in RISC-V Architectures,"VASCO 2 (ASIC Vehicle for Component Security) integrates innovative, patented hardware security building blocks on 22 nm FD-SOI silicon. It enables all types of standard or customized tests to validate these technologies in operational conditions in order to characterize innovative security blocks and to prepare a transfer to industry. VASCO 2 highlights the relevance and characteristics of these hardware IPs for industry by matching current challenges in hardware security: securing processors, securing and accelerating pre- and post-quantum cryptography, modelization and characterization of True Random Number Generators (TRNG), securing memories, etc. With VASCO 2, manufacturers have access to comprehensive data on hardware security IP: security level, power consumption, silicon surface area, and impact on cycle time.  ",,,
tue,12:30-14:00,"Lunch, Booth, Posters & Demos ",break,Demo Theatre,13:00,"Massimiliano (Max) Giacometti, OpenHW Group","OpenHW CVA6 Linux-capable, dual-core processor on Genesys2","The design freedoms of RISC-V offer systems and SoC developers new flexibility to optimize a processor for the requirements of the target application. Now Architectural Exploration is not just about the configuration of multi-core designs, but the analysis of the application and potential advantages of custom instructions. Custom extension can boost the performance for a target class of operations, or support new multi-core communication methods.Software development with virtual prototypes is well established, but new to RISC-V is the advantage of these platforms offer to end users migrating legacy applications to the new RISC-V based device, well before silicon is available.For SoC teams optimizing a RISC-V processor they also need to address the additional challenge of RISC-V verification, open standards such as The RISC-V Verification Interface (RVVI) are helping the ecosystem support for standards-based test benches and Verification IP. This talk highlights the RISC-V models that are unifying the hardware, software, and verification teams across all phases of RISC-V projects with dependable quality and efficiency.  ","Jon Taylor has over 20 years of experience in the semiconductor industry, working in technical areas from CPU verification to embedded software, and commercial areas including field applications and technology strategy. He has worked on multiple architectures including Arm, RISC-V and proprietary CPUs. He holds a degree from Southampton University in Electronic Engineering and is currently Director of Product Technology for Imperas working on technology to help enable the RISC-V revolution.  ",,
tue,12:30-14:00,"Lunch, Booth, Posters & Demos ",break,Demo Theatre,13:15,"Mikael Carmona, CEA","VASCO 2, an ASIC to highlight the latest innovations in security of component",,"Roger Espasa is the founder and CEO of Semidynamics, an IP supplier of two RISC-V cores, Avispado (in-order) and Atrevido (out-of-order) supporting the RISC-V vector extension and Gazzillion™ misses, both targeted at HPC and Machine Learning. In addition, Semidynamics architected and designed the Esperanto Technologies; 1024+ core machine-learning 7 nm SoC. Prior to Semidynamics, Roger was at Broadcom working on an ARMV8 wide out-of-order core. (2014-2016). Previously, Roger worked at Intel (2002-2014) developing a vector extension for the x86 ISA, initially deployed in XeonPhi (Larrabee) which then became AVX-512. Roger also led the texture sampling unit for Larrabee. Roger then worked on Knight’s Landing (14 nm) and led the core for Knights Hill (10 nm). Between 1999 and 2001 Roger worked for the Alpha Microprocessor Group on a vector extension to the Alpha architecture known as Tarantula. Roger got his PhD from UPC in 1997, has published over 40 peer-reviewed papers on Vector Architectures, Graphics/3D Architecture, Binary translation and optimization, Branch Prediction, and Media ISA Extensions and holds 9 patents with 41 international filings.  ",,
tue,12:30-14:00,"Lunch, Booth, Posters & Demos ",break,Demo Theatre,13:30,Jon Taylor - Imperas Software Ltd.,"RISC-V Models for Verification, Software Development and Architectural Exploration",,,,
tue,14:00-14:30,Keynotes,keynote,,14:00,"Roger Espasa, Semidynamics",Semidynamics Highly Configurable OOO Vector Unit,"In this talk we will disclose Semidynamics Out-of-Order RISC-V Vector unit, which is fully compliant with the RVV1.0 specification. We will disclose all the configuration options available for customers and discuss some performance data for an 8-lane configuration  ",,,2023-06-06-14h30-Roger-ESPASA-slides.pdf
tue,14:00-14:30,Keynotes,keynote,,14:15,"Michael Gielda, Antmicro",RISC-V and Antmicro’s visual system designer: Everything everywhere all at once,"RISC-V offers unprecedented freedom in designing hardware systems, prompting a renaissance in new core implementations, system building blocks and SW-HW co-design paradigms. Drawing on the experience of working with the expansive landscape of RISC-V implementations, both on the hardware and software level, Antmicro is developing a visual platform designer which helps navigate this complexity. The tool builds on the configurability of RISC-V and the our vast open source database of hardware components to let you create advanced, real-world systems which can be simulated with the open source Renode simulator and seeded with software such as Zephyr or Linux.

Thanks to Renode’s support for vector and custom instructions and integration with Google’s IREE toolchain through Antmicro’s Kenning ML framework, the designer is also a great entrypoint for hardware-accelerated ML co-design, and combined with Antmicro’s photorealistic 3D component model library and open source HW design methodology it can be used to kickstart the development of custom RISC-V based devices.

Combine cores and HW peripherals, SoCs, modules and other hardware components, all the way to heterogeneous connected systems to build, simulate and develop software for any kind of RISC-V platform. The transparency and flexibility of this comprehensive design paradigm will provide infinite possibilities for collecting both hardware and software data for efficient co-design",,,2023-06-06-14h15-Michael-GIELDA-slides.pdf
tue,14:30-15:30,Technical Talks ,technical,,14:30,"Anthony Zgheib, CEA Leti",Enhancing the RISC-V Trace Encoder to verify the control-flow and code execution integrity,,,,2023-06-06-14h30-Anthony-ZGHEIB-slides.pdf
tue,14:30-15:30,Technical Talks ,technical,,14:45,"Stefano Mercogliano, University of Naples Federico II",Enabling Virtualisation on RISC-V Microcontrollers,,,,2023-06-06-14h45-Stefano-MERCOGLIANO-slides.pdf
tue,14:30-15:30,Technical Talks ,technical,,15:00,"Franz Fuchs, University of Cambridge",Mitigating Transient-Execution Attacks with CHERI Compartments,,,,2023-06-06-15h00-Franz-FUCHS-slides.pdf
tue,14:30-15:30,Technical Talks ,technical,,15:15,"Jimmy Le Rhun, Thales Research and Technology","Safe, Secure and Reliable Computing with the NOEL-V Processor: from the De-RISC H2020 Project and onward",,,2023-06-06-15h15-Jimmy-LE-RHUN-abstract.pdf,2023-06-06-15h15-Jimmy-LE-RHUN-slides.pdf
tue,15:30-16:30,"Break, Booth, Posters & Demos ",break,,,,Exhibition / Poster Sessions ,,,,
tue,16:30-17:00,Keynotes,keynote,,16:30,"Franck Bernard, Bosch",The RISC-V opportunity in Automotive Electronics,,"A digital transformation of the car is currently taking place, driven by powertrain electrification, increased levels of autonomy, new in-car experiences and the trend towards the Software-defined vehicle. The automotive supply chain is looking for the computing architectures that can deliver this future.

In this talk, we will examine the opportunity that Bosch sees in the RISC-V ISA and how it can be applied to future automotive challenges. We will detail architectural trends and the move from distributed to domain-centralized and then vehicle-centralized compute. The processing needs of the different in-car processing modules will be discussed, including performance requirements and the range of cores that will be required.

We will discuss the benefits that the RISC-V architecture can bring to Bosch as an automotive supplier and how Bosch is engaging with the RISC-V ecosystem to address its computing needs across both hardware and software, as well as key considerations such as Functional Safety and Security, in both the short and long term.","Franck Bernard holds an Engineer degree in control processing from Grenoble INP and a Master of Sciences in image processing from Paris Telecom Engineering school (ENST). He started his career as researcher at Philips Electronic Lab in 1990 working in medical imaging before moving as system architect mgr for 3G Chips still with Philips. He moved to semiconductor business in 2002 as Program Manager for the 3G modem with Philips Semiconductor, and was appointed as director of IC development for 4G modem with NXP and then with ST-Ericsson. Joining STMicroelectronics in 2012, he was managing the development of Smart Rear Camera IC, and spent 2 years as technical marketing manager in the STMicroelectronics ASIC business before joining Bosch Automotive Electronics in 2015. Since then he is deputy manager of the EIY group in charge of developing Digital IPs and System on Chips for the automotive business.  ",2023-06-06-16h30-Franck-BERNARD-slides.pdf
tue,17:00-17:15,Industry Talk ,technical,,17:00,"Peter Lewin, Imagination",Developing a RISC-V Automotive Safety Island,,,,2023-06-06-17h00-Peter-LEWIN-slides.pdf
tue,17:15-17:30,Technical Talks,technical,,17:15,"Abdoulaye Berthe, Low Power Futures",RISC-V Trusted MCU for Functional Safety Applications,,,,
tue,17:30-18:15,Panel,keynote,,17:30,"Nitin Dahad, embedded.com (moderator). Andrew Frame, SiFive. Travis Lanier, Ventana. Peter Lewin, Imagination. Charlie Su, Andes. Itai Yarom, MIPS",What’s the reality of RISC-V in automotive?,,,,
tue,18:15-20:15,"On-Site Cocktail, Booth, Posters & Demos",social,,,,"Join us for an Cocktail Reception in the Exhibition area, where you can connect with visitors, speakers, and our sponsors at their stands.",,,,
wed,8:00-8:45,Breakfast Panel,break,,8:00,,Collaboration and Culture: Leveraging Diverse Strengths to Cultivate a Stronger Community,"It takes a global community to bring out the best of an open standard.  So how do we tap into and embrace the diversity of the ecosystem to strengthen solutions around RISC-V? RISC-V is a global standard, so it requires groups around the world to find ways to bring together individuals with different skillsets and experience, in different stages in their careers, from various industries, or across different regions, and channeling their strengths to make RISC-V the standard for open computing. From projects in Europe that pull together members across industry, academia and research, to individuals that need to rally resources across a nation or a university, here’s a chance to hear from members of the global community on how they address culture. create high-performing groups and collaborate to get the most out of their teams. 

Panelists:
- Dr Yungang Bao, China RISC-V Alliance (CRVA), Beijing Institute of Open-Source Chip (BOSC)
- John D. Davis, BSC
- Gianna Paulin, Integrated Systems Laboratory (IIS) / ETH Zurich
- Calista Redmond, RISC-V International, moderator.",,,
