day,blocktime,blocktitle,type,extra,time,name,title,abstract,bio,video,slides
wed,10:30-11:30,"Break, Booth, Posters & Demos",break,,10:40,"Lilia Zaourar, CEA","Demo Theatre Talk: Exploring RISC-V architectures with VPSim, a virtual prototyping environment with the best trade-off between simulation speed & accuracy","With the increase of complexity of computing systems, virtual prototyping is widely adopted as an efficient and cost-effective solution for early hardware/software co-design and co-validation. VPSim, a virtual prototyping environment developed by CEA List, is designed to meet industrial needs: VPSim provides the best possible trade-off between accuracy and performance (simulation speed) enabling early design space exploration of complex systems, electronics boards, and integrated circuits. With a strategy of open source the tool, we will introduce its key features and development roadmap to allow full system simulation with different IPs, including Arm, RISC V, a NoC and several memories for different HPC and embedded needs, to assess performances and enable exploration.","Dr. Lilia Zaourar is a CEA expert in co-design techniques for Computing Architectures at CEA LIST.  She received an MS and PhD in Operational Research and Computer Science from the University Joseph Fourier, Grenoble, in 2007 and 2010, respectively. She developed various optimization algorithms for the design and test of integrated circuits. Then, she was a temporary teaching and research assistant at the SoC department in Computer Science PARIS 6 Laboratory, Sorbonne University, from 2010 to 2012. She was involved in developing optimization strategies for the resource-sharing problem to test embedded memories. She joined the CEA LIST in 2012 and has participated in various national, European, and industrial research projects on real-time mixed-criticality systems, optimization strategies of runtime software for heterogeneous HPC and microservers, and FPGA emulation.
She led Modelling and Simulation activities within the first phase of the European Processor Initiative (EPI) project. She is currently involved in the second phase of EPI on co-design and exploration. Her research interests cover combinatorial optimization and operational research techniques with a special focus on optimization problems for electronic design automation and high-performance embedded systems, as well as testing and security. She is the project leader of the working group “integrated system optimization” funded by the French institution CNRS. She has been a SAMOS, SC, PMBS, and CoDit technical programs member. She has served as General Chair for Hipeac/Rapido 2023, 2024, and General Chair of the 50th Euromicro DSD/SEAA 2024 conference.",,
wed,10:30-11:30,"Break, Booth, Posters & Demos",break,,10:50,"Markus Goehrle & Michael Schleinkofer, Lauterbach GmbH",Demo Theatre Talk: Heterogeneous Multicore Debugging of RISC-V Cores in Complex Chips,"RISC-V cores can be found in more and more chips - as the main CPU(s) or as a companion core together with other CPU architectures. Each chip and core supplier can decide individually which functions its RISC-V core(s) support and how they are integrated into the overall system. While the complexity of SoCs grows with the number of cores and the number of different core architectures, the challenges for embedded developers grow even more with operating systems, hypervisors, and other software running on multiple cores.
In this presentation experts of Lauterbach, market leader for development tools and strategic member of the RISC-V foundation, show how developers can overcome these challenges with the right tools and debug strategies. They explain how to debug cores from RISC-V and other architectures simultaneously via one debug interface and one debug probe to gain insight into the entire embedded system. The presentation covers real-time on- and off-chip tracing for all major RISC-V trace systems as well as the utilization of standardized RISC-V debug and trace interfaces.
All in all, the attendee learns that multicore debugging with RISC-V cores is not rocket science and that there are efficient methods to master even complex chips with complex software configurations.","M.Sc. Markus Goehrle
studied Electrical Engineering and Information Technology at the Technical University of Munich and graduated with an M.Sc. degree. Since 2015 he has been working at Lauterbach as a System Engineer and since 2017 in the RISC-V Debug and Trace team. As a member of the RISC-V Debug/N-Trace workgroups, he contributed significantly to the RISC-V Debug Standard as well as the RISC-V N-Trace Specification. He is also a member of the RISC-V Debug, Trace, and Performance Monitoring Special Interest Group.

M.Sc. Michael Schleinkofer
studied Computer Science at the OTH Regensburg and graduated with an M.Sc. degree. Since 2019 he has been working at Lauterbach as a System Engineer in the RISC-V Debug and Trace team. As a member of the RISC-V E-Trace workgroup, he contributed significantly to the RISC-V E-Trace Encapsulation Specification, and he is also a member of the RISC-V Debug, Trace and Performance Monitoring Special Interest Group.",,
wed,10:30-11:30,"Break, Booth, Posters & Demos",break,,11:00,"Shan Liu, Beijing Institute of Open Source Chip",Demo Theatre Talk: UnityChip Verification: Open-Source RISC-V Verification at BOSC,"As chip designs become increasingly complex, the cost of verification rises, presenting significant challenges for verification. In response to this trend, UnityChip verification has emerged as an innovative solution aimed at lowering verification barriers, improve verification productivity, and reducing engineering costs. This presentation provides an overview of the development, implementation methodology and current status of UnityChip verification at BOSC. It takes Xiangshan RISC-V CPU as a case study to showcase the feasibility and accomplishments of UnityChip verification, highlighting its potential impact on future RISC-V chip verification practices.","Shan Liu is a skilled IP developer with six years of experience in the semiconductor industry. Formerly a technical leader at Intel, she now leads the Memory Subsystem team at BOSC. Shan specializes in external memory, Network-on-Chip, CPU emulation, FPGA verification, and FPGA acceleration.",,
wed,10:30-11:30,"Break, Booth, Posters & Demos",break,,11:10,"Andrew Jones, Ventana Micro Systems",Demo Theatre Talk: KVM device assignment for virtual machines using the RISC-V IOMMU,"The RISC-V IOMMU provides capabilities supporting device assignment, which is the provision of host devices to virtual machines where they appear to the guest operating systems as though they have been physically attached. Beyond the restriction of device DMAs to guest memory, the RISC-V IOMMU, in conjunction with the RISC-V AIA, additionally supports directing interrupts to guest VCPUs, which is a feature also referred to as irqbypass.  We demonstrate device assignment with the RISC-V IOMMU including its irqbypass support on a Linux/KVM host running on a QEMU machine model.","Andrew Jones is a Principal Software Engineer at Ventana Micro Systems Inc.  Andrew has nearly 20 years of software engineering experience with
the majority being in the enterprise virtualization domain building standards-based software stacks and test frameworks. At Ventana, Andrew currently contributes to the SBI and FFH specifications, to the KVM, Linux, OpenSBI, and QEMU software components, and to the KVM and Linux selftests and kvm-unit-tests test frameworks.",,
wed,11:30-11:45,Invited,keynote,,11:30,"Larry Wikelius, RISE",Updates from the RISC-V Software Ecosystem (RISE) Project,,,,
wed,11:45-12:30,Talks,technical,,11:45,"Nathan Egge, Google",Optimizing Software for RISC-V,,,,
wed,11:45-12:30,Talks,technical,,12:00,"Robin Dapp, Ventana Micro",GCC 14 RISC-V Vectorization Improvements and Future Work,,,,
wed,11:45-12:30,Talks,technical,,12:15,"Philipp van Kempen, Technical University of Munich",Towards Automated LLVM Support and Autovectorization for RISC-V ISA Extensions,,,,
wed,12:30-14:00,"Lunch, Booth, Posters & Demos",break,,12:30,,"Lunch, Booth, Posters & Demos",,,,
wed,14:00-14:15,Invited,keynote,,14:00,"Alex Kocher, Quintauris",Navigating Tomorrow's Roads: Aligning RISC-V to Automotive Requirements,,,,
wed,14:15-15:00,Talks,technical,,14:15,"Nicolas Tribie, Bosch FR",Real Time additions to the CVA6 Core,,,,
wed,14:15-15:00,Talks,technical,,14:30,"Michael P Rogenmoser, ETH Zurich","SentryCore: A RISC-V Co-Processor System for Safe, Real-Time Control Applications",,,,
wed,14:15-15:00,Talks,technical,,14:45,"Giancarlo Parodi, Renesas Electronics",Breaking the RISC-V MCUs ecosystem barriers,,,,
wed,15:00-16:00,"Break, Booth, Posters & Demos",break,,15:10,"Greg Chadwick, lowRISC",Demo Theatre Talk: Introducing Sonata — the new open source platform for CHERIoT development,"Sonata is a development system designed to enable the evaluation of CHERIoT, a RISC-V extension (including a reference core and RTOS) developed by Microsoft which eliminates most common memory safety issues. In this presentation we will demonstrate Sonata's features including the CHERIoT IbexⓇ core and a variety of peripherals (I2C, SPI, GPIO, PWM, UART, and DMA). Sonata has been designed by lowRISC, as part of the Sunburst Project, and is fully open source (available on GitHub under an Apache 2.0 license). It is designed for use on Artix-7 FPGAs and specifically targets the Sonata board designed by NewAE which we'll be using for this demonstration.
This work is funded by and done in collaboration with DSbD (Digital Security by Design) / UKRI.",,,
wed,15:00-16:00,"Break, Booth, Posters & Demos",break,,15:20,,"Demo Theatre Talk, tba",,,,
wed,15:00-16:00,"Break, Booth, Posters & Demos",break,,15:30,,"Demo Theatre Talk, tba",,,,
wed,15:00-16:00,"Break, Booth, Posters & Demos",break,,15:40,,"Demo Theatre Talk, tba",,,,
wed,16:00-16:45,Talks,technical,,16:00,"Daniel Silverstone, Codethink Ltd",Bringing Tier-1 support for Rust to 64-bit RISC-V Linux.,,,,
wed,16:00-16:45,Invited,keynote,,16:15,"Teresa Cervero, BSC","RISC-V@BSC: Fostering RISC-V strategy in the EU through Research, Innovation & Education",,,,
wed,16:00-16:45,Talks,technical,,16:30,"Ramon Canal, Universitat Politècnica de Catalunya",Vitamin-V: Expanding Open-Source RISC-V Cloud Environments,"Among the key contributions of Vitamin-V (2023-2025 Horizon Europe project), we develop a complete RISC-V open-source software stack for cloud services with comparable performance to the cloud-dominant x86 counterpart. In this paper, we detail the software suites and applications ported plus the three cloud setups under evaluation.",,,
wed,16:45-17:15,Panel Introduction Keynote,keynote,,16:45,"Georgi Kuzmanov, Chips JU",tba,,,,
wed,17:15-18:00,Panel,keynote,,17:15,,How can Europe engage more in RISC-V?,,,,
wed,20:00-24:00,Social Event @ Tonhalle,social,,20:00,,Social Event @ Tonhalle,,,,
thu,09:00-09:30,Keynote,keynote,,09:00,"Bernhard Quendt, Thales",T(h)ales in Open Source Hardware,,,,
thu,09:30-10:30,Talks,technical,,09:30,"Mathieu Bacou, Télécom SudParis","We had 64-bit, yes. What about second 64-bit?",,,,
thu,09:30-10:30,Talks,technical,,09:45,"Kari Hepola, Tampere University",Open-Source Development Platform for RISC-V Application-Specific Instruction-Set Processors,,,,
thu,09:30-10:30,Talks,technical,,10:00,"Simon Rokicki, Irisa",Design Exploration of RISC-V Soft-Cores through Speculative High-Level Synthesis,,,,
thu,09:30-10:30,Talks,technical,,10:15,"Max Brunton, Codeplay",Bring your code to RISC-V accelerators with SYCL,,,,
thu,10:30-11:30,"Break, Booth, Posters & Hackathon Demos",break,,10:30,,"Break, Booth, Posters & Hackathon Demos",,,,
thu,11:30-12:30,Talks,technical,,11:30,,INNOVATION FORUM,,,,
thu,12:30-14:00,"Lunch, Booth, Posters & University Demos",break,,12:30,,"Lunch, Booth, Posters & University Demos",,,,
thu,14:00-14:15,Talks,technical,,14:00,"Keerthikumara Devarajegowda, Siemens",Ensuring Datapath Integrity and Adherence with Formal Security Verification in RISC-V Implementation,"The cornerstone of all security applications is hardware, underscoring the importance of meticulously verifying its security features. As the adoption of RISC-V grows, there is an increasing emphasis on enhancing security features in ASIC and FPGA designs. The protection of sensitive data, including encryption keys, passwords, and biometric information, is paramount, as these are prime targets for security breaches that can lead to costly, damaging, and embarrassing consequences. Challenges in security verification that must be addressed include ensuring data confidentiality, integrity, and inversion, as well as mitigating the exploitation of sneak paths, addressing inefficient verification flows, and managing the added complexity. In this context, formal technology stands out as the sole method that guarantees the security requirements of datapaths are fulfilled. Our methodology introduces a high degree automation to expedite the security verification process, showcasing its applicability and debugging prowess in a RISC-V implementation, specifically with OpenTitan. The paper will present our findings, providing detailed explanations and runtime information, highlighting our approach's effectiveness in enhancing security verification.",,,
thu,14:15-15:00,Talks,technical,,14:15,"Gerard Rauwerda, Technolution",Instrument Control & Data Processing for high-reliable ‘New Space' instruments,,,,
thu,14:15-15:00,Talks,technical,,14:30,"Andrea Bocco, Univ. Grenoble Alpes, CEA",VRP: a Variable Precision Accelerator for Scientific Computing Applications,"We develop a RISC-V based accelerator called VRP (VaRiable precision Processor). It efficienctly computes extended precision arithmetic operations, up to 512 bits. This improves convergence issues encountered using linear algebra solvers for scientific applications. This work details the VRP hardware architecture which is used as an accelerator for faster time to solution, with demonstrated reduction of solver execution time by up to 5x.",,,
thu,14:15-15:00,Talks,technical,,14:45,"Larry Lapides, Synopsys","Open Virtual Platforms APIs Enable High Quality, Easily Maintained RISC-V Processor Models",,,,
thu,15:00-16:00,"Break, Booth, Posters & University Demos",,,15:00,,"Break, Booth, Posters & University Demos",,,,
thu,16:00-16:15,Invited,keynote,,16:00,"Johanna Baehr, Fraunhofer AISEC",RISC-V and Trusted Electronics: a match made in heaven?,,,,
thu,16:15-17:30,Talks,technical,,16:15,"Tariq Kurd, Codasip",Standardizing CHERI for RISC-V,,,,
thu,16:15-17:30,Talks,technical,,16:30,"Bruno Sa, University of Minho - Centro ALGORITMI/LASI",CHERI RISC-V: A Case Study on the CVA6,,,,
thu,16:15-17:30,Talks,technical,,16:45,"Lowie Deferme DistriNet, KU Leuven",RISC-V Hypervisor extension formalization in Sail,,,,
thu,16:15-17:30,Talks,technical,,17:00,"Luis Cunha, University of Minho",Open-source RISC-V Input/Output Physical Memory Protection (IOPMP) IP,,,,
thu,16:15-17:30,Talks,technical,,17:15,"Alex Wezel, RPTU Kaiserslautern-Landau",Unique Program Execution Checking: Formal Security Guarantees for RISC-V Systems,,,,
