Id,Type,Blindness,Day,Time,AbstractFileName,SlidesFileName,Title,Authors,abstract_url,Abstract
BLF3DX,invited talk,False,10-Wed,14h30,2026-06-10-RISC-V-Summit-Europe-14h30-TOMSICH-abstract.pdf,2026-06-10-RISC-V-Summit-Europe-14h30-TOMSICH-slides.pdf,Matrix Extensions for RISC-V: Delivering on the Promise,Dr. Philipp Tomsich,,"When the RISC-V matrix extensions effort was restructured into four complementary approaches at Summit Europe 2025 in Paris, it was a bold architectural bet — that the breadth of the RISC-V ecosystem demands not one rigid solution but a family of extensions spanning from lightweight vector-matrix primitives to fully independent matrix engines. One year later, that bet is paying off. This talk reports on the rapid progress across the matrix extension family as two of the four extensions — the Integrated Matrix Extensions (IME) and the Vector Matrix Extensions (VME) — converge on specification freeze. We trace the architectural decisions that brought IME and VME from concept to maturity: algebraic tile geometry that scales naturally with VLEN, the deliberate reuse of RVV state for seamless software integration, and the introduction of dedicated accumulator registers to unlock higher computational intensity where implementations demand it. Crucially, work is starting to unify IME and VME through a common LLVM-MLIR lowering path — giving compilers and AI/ML frameworks a single abstraction that targets both extensions, ensuring that the software ecosystem scales with the hardware rather than fragmenting across it. For Europe's semiconductor industry — from research institutions and startups to established design houses — standardized, open matrix extensions represent a strategic opportunity: competitive AI/ML and HPC capability on an open ISA, free from proprietary lock-in. RISC-V matrix support is no longer a roadmap item. It is arriving."
GLNQVZ,invited talk,False,10-Wed,16h30,2026-06-10-RISC-V-Summit-Europe-16h30-WILFORD-abstract.pdf,2026-06-10-RISC-V-Summit-Europe-16h30-WILFORD-slides.pdf,Transforming MCUs in an AI-Defined Era,Edward Wilford,,"As artificial intelligence reshapes embedded systems, MCUs are evolving from simple control devices into intelligent, distributed computing nodes. This talk explores how RISC-V architecture and scalable AI frameworks are enabling a pragmatic, incremental approach to system transformation—particularly critical in automotive applications where safety, reliability, and legacy integration remain paramount."
MZ9RFR,invited talk,False,11-Thu,14h30,2026-06-11-RISC-V-Summit-Europe-14h30-HOLLAND-abstract.pdf,2026-06-11-RISC-V-Summit-Europe-14h30-HOLLAND-slides.pdf,RISC‑V at Scale: From Embedded Dominance to Application Processor Opportunities,John Holland,,"RISC‑V has emerged as one of the most important new architectures in decades, achieving widespread adoption in embedded systems and shipping at massive scale. But as the industry looks beyond embedded into application processors, a new set of challenges—and opportunities—comes into focus.

This talk explores where RISC‑V stands today, what makes its next phase of growth fundamentally different, and why its future is likely to unfold unevenly across markets. It highlights key inflection points that will shape adoption and outlines where RISC‑V is poised to gain traction next."
SPMRUA,invited talk,False,09-Tue,14h30,2026-06-09-RISC-V-Summit-Europe-14h30-KRČMÁŘ-abstract.pdf,2026-06-09-RISC-V-Summit-Europe-14h30-KRČMÁŘ-slides.pdf,RISC-V Server Platform 1.0: One Spec to Boot Them All,Radim Krčmář,,"As RISC‑V enters high‑performance computing (from traditional data‑center servers to edge infrastructure, telecom systems, and industrial compute platforms) a unified platform definition is essential. Without a consistent hardware and firmware contract, system‑software vendors face fragmented bring‑up, slowing ecosystem adoption.

The RISC‑V Server Platform Specification solves this by defining a clear baseline that supports high‑performance RISC‑V platforms. Built by composing existing standards such as the RVA23 profile, Server‑class SoC requirements, UEFI/ACPI boot via BRS, SBI interfaces, and modern security foundations including roots of trust, secure boot, attestation, and BMC‑based management, the specification enables OS and hypervisor developers to target a single portable binary.

This talk outlines the goals, structure, and key requirements of Server Platform Specification 1.0, explaining how it reduces fragmentation, accelerates system‑software portability, and provides a stable foundation for interoperable, production‑ready RISC‑V platforms across diverse deployment environments."
USADYC,invited talk,False,09-Tue,16h45,2026-06-09-RISC-V-Summit-Europe-16h45-DELLOW-abstract.pdf,2026-06-09-RISC-V-Summit-Europe-16h45-DELLOW-slides.pdf,Beyond Privilege: The RISC‑V Isolation Toolbox from Microcontrollers to Confidential Computing,Andrew dellow,,"This talk surveys the RISC‑V isolation toolbox—spanning PMP/ePMP, SPMP, privilege levels, virtualization, Risc-V Worlds, and emerging Supervisor Domains—and shows how these mechanisms can be combined to build scalable, composable security and safety systems beyond traditional privilege separation.

RISC‑V has steadily developed a rich and diverse set of isolation mechanisms, including ePMP for physical memory protection, privilege levels for execution control, page‑based virtual memory for scalable address isolation, hypervisor extensions for virtualization, and Worlds for hardware‑enforced compartmentalization. Each of these tools addresses different isolation challenges, from resource‑constrained microcontrollers to full server‑class systems.

Modern platforms increasingly demand fine‑grained, composable isolation rather than coarse, monolithic privilege separation. Mixed‑criticality systems, safety‑certified embedded platforms, and confidential computing environments all require isolation techniques that can be layered, combined, and adapted to different threat models and deployment constraints.

This talk presents a toolbox‑oriented view of RISC‑V isolation.

Supervisor Domains are introduced as an emerging architectural direction within this toolbox, exploring finer‑grained isolation within supervisor mode itself. While still evolving, Supervisor Domains illustrate the broader move beyond privilege levels toward more modular and composable execution domains and provide a useful lens for understanding how future RISC‑V systems may further decompose trusted software."
